Review,Categories
"wheres the new version? i reinstall its still old, the notification said i use previous version",Versioning & Updates
"Why PWA check is gone?",Feature Requests
"Highly recommend this SEO friendly tool for your website", Positive Feedback
"I do not have the PWA option in any browser and with any PWA web site.",Feature Requests
"There is no pwa test option showing in my pc only four options it is showing performance,seo,accessibilty,best practice, is there any other thing we have to change in setting if any one has the idea of this problem please tell me","Feature Requests, Performance & Accuracy"
"Where is PWA test?",Feature Requests
"Nice tool to get in-depth analysis for website in desktop & mobile mode. Also provides one to one suggestion for issues solving.", Positive Feedback
"Good extension but I honestly prefer to just use the chrome dev tools instead without an extra extension, nonetheless cant really complain didn't have any issues just not much reason to keep it when its built in by pressing F12..?",Usability & Workflow
"Great Tool!",Positive Feedback
"I love this! Whenever a website is slow, I can see if it's my issue or if the website is acting up.",Positive Feedback
"Could it be that the lighthouse score is based on network latency and that you're experiencing some type of cold start on your http service?",Versioning & Updates
"I had a client complain once because their pagespeed score was in the low 40's. I ignored the email since this was an old site (built before pagespeed existed) and a client I fired for multiple reasons a few years back. Anyhow, they emailed to thank me the next day because the score was in the 90's. I didn't change a thing, nor did anyone else. [deleted] • 3y ago They should have tipped you for ""the extra work"" haha.. 1 more 1 more More replies","Usability & Workflow, Versioning & Updates"
"They should have tipped you for ""the extra work"" haha..", Usability & Workflow
"Maybe your servers are inconsistent? check the details to see which resources are taking the longest.",Performance & Accuracy
"If you cannot consistently get 90+ scores, you need to optimize something. Might be server side, might be client side.",Performance & Accuracy
"I have done this many times and can get to 100 points with a bit of effort.", Performance & Accuracy
"Also i.e. IIS (Windows webserver) does not gzip compress static files unless they are accessed often - and other stuff like that. So everytime you need to run a Lighthouse test, press F5 a couple of times on the page before running the tool.", Feature Requests
"Lighthouse measures real performance - so if you check an online website, and it sometimes has load from other visitors, your score will be affected because of lacking performance. If you cannot consistently get 90+ scores, you need to optimize something. Might be server side, might be client side. I have done this many times and can get to 100 points with a bit of effort. Also i.e. IIS (Windows webserver) does not gzip compress static files unless they are accessed often - and other stuff like that. So everytime you need to run a Lighthouse test, press F5 a couple of times on the page before running the tool. Gin-Chan • 3y ago Pressing F5 to warm up a cache or anything like that is a bad idea. You're just fooling yourself with that, if the cold load for a given page is slow, this is what your visitors will experience. Test under the worst possible conditions (empty server & client cache), then use the results to inform your optimization strategy. If the server doesn't gzip content where appropriate, go fix the server.","Performance & Accuracy, Versioning & Updates, Negative Feedback or Complaints"
"Pressing F5 to warm up a cache or anything like that is a bad idea. You're just fooling yourself with that, if the cold load for a given page is slow, this is what your visitors will experience. Test under the worst possible conditions (empty server & client cache), then use the results to inform your optimization strategy. If the server doesn't gzip content where appropriate, go fix the server.","Performance & Accuracy, Versioning & Updates, Negative Feedback or Complaints"
"If you want to check for actual page speed then use https://pagespeed.web.dev/.", Feature Requests
"That will grade your page speed as a Google Bot would, which is far more useful to know if you'll be indexed properly or not.", Performance & Accuracy
"Don't use the debug tools lighthouse scores, those are mainly for checking if you have bad imports or any accessibility issues. If you want to check for actual page speed then use https://pagespeed.web.dev/. That will grade your page speed as a Google Bot would, which is far more useful to know if you'll be indexed properly or not. 10 more replies 10 more replies More replies",Negative Feedback or Complaints
"You have to combine different versions of lighthouse. Some are synthetic some are real. I usually run bunch on web.dev, then some on my machine, mixed with gtmetrix and page speed insight.",Versioning & Updates
"I did a video about Lighthouse earlier this year. I think it's great. It definitely found problems with my website and I fixed them.",Positive Feedback
"The numbers might fluctuate on a bunch of things. One... are you using http or https when you enter the URL? If your site redirects to https, you could lose points because of the redirection. If you're not using https, then you're going to lose points.", Performance & Accuracy
"It's hard to know if it's a problem with lighthouse without seeing the report. I've seen fluctuation of a few percentage points. But that big of a range is probably something else.",Usability & Workflow
"I don't know what's wrong, but I suspect there might be something wrong with the site.", Negative Feedback or Complaints
"I did a video about Lighthouse earlier this year. I think it's great. It definitely found problems with my website and I fixed them. The numbers might fluctuate on a bunch of things. One... are you using http or https when you enter the URL? If your site redirects to https, you could lose points because of the redirection. If you're not using https, then you're going to lose points. It's hard to know if it's a problem with lighthouse without seeing the report. I've seen fluctuation of a few percentage points. But that big of a range is probably something else. I don't know what's wrong, but I suspect there might be something wrong with the site.","Usability & Workflow, Positive Feedback"
"I've also seen Lighthouse scores fluctuate pretty wildly - exact same page, run seconds apart. I started to asking averages, which gets pretty time-consuming, but hopefully a bit more reliable.",Performance & Accuracy
"Make sure to cross reference with lighthouse-metrics and gtmetrics because I have found sometimes mine and others sites will score very high on the later and poorly on the former which is curious",Performance & Accuracy
"To get more consistent results you can try to use synthetic web performance monitoring using tools like SpeedCurve.",Performance & Accuracy
"Yep, Lighthouse behave strange last year, sometimes you change something in caching an it decreases Cumulative Layout Shift etc... I just working with main issues, and Lighthouse recommendations is just a hints, no more. I hope you know, the most important part is to render the first screen (above the fold) as fast as possible. Postpone loading of content below. Preloading images for first screen. Preferably no JS in header etc. It always go good, but CLS really hurts, and last time I don't understand why it can be fixed with caching reconfigured etc.",Versioning & Updates
"By the way, real data from visitors for CLS is ok.", Positive Feedback
"Lighthouse is great because it helps you identify easy wins for performance and accessibility. No one ever made their website worse by following lighthouse optimization recommendations.","Usability & Workflow, Performance & Accuracy, Positive Feedback"
"Google lighthouse results are one of the factors ranked by Google search.Do poorly and you will be punished on Google.com",Performance & Accuracy
"You can score 100 on accessibility and still ship an unusable piece of shit. I'm not sure if the others stack up like that, but I doubt it; I imagine performance is done if it says 100? Accessibility testing still requires manual testing and common sense for the majority.","Usability & Workflow, Performance & Accuracy"
"Lighthouse is a useful tool, but I would also conduct some simple usability tests if you can. See Steve Krug's book, Don't Make Me Think.", Feature Requests 
"In terms of accessibility you'd be better off using aXe dev tools or running aXe against your pages via automated tests. Lighthouse uses a subset of aXe tests for accessibility, aXe itself only covers about 50%, iirc, of WCAG standards. Essentially Lighthouse is a good indicator of accessibility but it isn't that comprehensive and ultimately if you think ""wow we got 100 for a11y on Lighthouse"" and never bother to test accessibility any further you've probably got a bunch of a11y issues.", "Feature Requests, Negative Feedback or Complaints"
"Yes. Make the initial changes in LH then use Google's page speed tool to get additional insights into performance. Also, try using slow 3g and disable cache, will help you identify slow network issues on mobile such as CLS.",Performance & Accuracy
"Website content is more important, don't get bogged down by lighthouse. Just use it to look to cherry pick easy issues then move on. https://gtmetrix.com/ also a good site to find issues.",Usability & Workflow
"I've seen Lighthouse report some comically inaccurate performance numbers (such as a 0.5s page load being reported as a 15 second page load), so definitely don't use its perf metrics as gospel. However, the Lighthouse suggestions for improving performance are all solid","Performance & Accuracy, Negative Feedback or Complaints"
"Absolutely. Considering Google dominates search engine use you're literally looking at how well your page will rank. There are definitely other things you can do that Lighthouse doesn't cover, but it's very helpful.",Positive Feedback
"Yes, it's good to have a performance indicator of a site in a dev environment, but as user numbers increase and the variety of devices so, it's worth switching to real data measurement tools like GA.",Performance & Accuracy
"Yes, Google Lighthouse is a great metric... for Google.",Positive Feedback
"I'm still waiting for a ChatGPT-like tool for scoring content the way pagespeed tools rank page mechanics. A (possibly very large) subset of people focus on numerical scores, page rankers assign numerical scores, and therefore those people focus intently on boosting their numbers over content credibility, readability, and authority.", Feature Requests
"excellent, thanks you.", Positive Feedback
"Supertool! Thanks for authors.", Positive Feedback
"Excelent tool for enhancing the performance of your website, the report is quite extensive","Usability & Workflow, Performance & Accuracy"
"Great extension. I have about 5 years since I am using it and is one of the 4 that I always have pined.","Usability & Workflow, Positive Feedback"
"Why can't I easily find the mobile-friendly view option? It's frustrating and a waste of time.","Negative Feedback or Complaints, Feature Requests"
"New update that removes it from the developer tools limits the functionality to only giving it an URL. This limits websites that use auth in different ways such as cookie tokens, tab exclusive auth tokens, etc. It opens on a new tab which I rather not.","Feature Requests, Versioning & Updates"
"Good plugin but would be more useful if it also included desktop tests. Only mobile tests are currently being performed", Feature Requests
"Amazing, for some reason that I ignore this Lighthouse addon works one thousand times better than the version integrated in the browser.  Congratulations guys, keep the good work.",Versioning & Updates
"Not working at all!!!", Negative Feedback or Complaints
"It looks greeat trying to improve our eshop https://eshop.vinarstvizapletal.cz/", Positive Feedback
"Lighthouse dev tools is a good utility tool from chrome web store.", Positive Feedback
"It works, but the problem is that it hasn't been updated in so long that it is using an old Lighthouse version.  Even get a lil notification saying that.  So it's better to just use an alternative means of getting this data.",Versioning & Updates
"Since 2019 Oct, the extension has simply used Page Speed Insights API and so has been using the most recent version of Lighthouse ever since. We don't need to update the extension with every new Lighthouse release.","Usability & Workflow, Versioning & Updates"
"Works well but gives totaly different report than the console version of lighthouse. Why? whats up with that?",Versioning & Updates
"Very useful, not complicated", Positive Feedback
"i like it so far!", Positive Feedback
"good choice , well worth a look", Positive Feedback
"its very nice", Positive Feedback
"Sadly, this hasn't been updated since Version 8.0 and the latest is 8.3. If you rely on this tool now, you're getting a way different reading from what Google is getting.",Versioning & Updates
"Since 2019 Oct, the extension has simply used Page Speed Insights API and so has been using the most recent version of Lighthouse ever since. We don't need to update the extension with every new Lighthouse release.","Usability & Workflow, Versioning & Updates"
"Neat. I'm not a programmer but it's a lil entartaining seeing the report of sites. Does it's stuff", Positive Feedback
"This is pretty useful!I the only things I think is missing are: 1. Present both mobile/desktop results instea of each separetly, we actually need both! 2. Please add the locale query string parameter into the settings (My clients are spanish speakers, so I have to add &locale=es to each new report. Thanks!!!","Feature Requests, Performance & Accuracy, Negative Feedback or Complaints"
"I like having the choice between the extension and the option in devtools. Can you document somewhere what version of axe is being used for the accessibility checks? Axe 4.2 has about twice as many accessibility tests as lighthouse so it would be good to understand the differences in a clear manner.","Usability & Workflow, Versioning & Updates"
"It doesn't support incognito mode. If I run a test in incognito mode, it opens the test result in normal browser, fix this issue plz then it will be worth of 5*",
"How update to 7.2.0",Versioning & Updates
"It is very useful toll, when it will be updated? Last Updated November 20, 2019",Versioning & Updates
"No need to update, it uses the latest version of Lighthouse always via the PageSpeed Insights API.",Versioning & Updates
"nice", Positive Feedback
"Just got introduced into Lighthouse 6.0 and I honestly love the features it has to offer! The small suggestions on what should be changed on the website do help for those freelance web developers with no design experience. Thank you Devs!","Feature Requests, Positive Feedback"
"good plugin.", Positive Feedback
"dont  show in extension bar",Usability & Workflow
"nice tools", Positive Feedback
"update version pls",Versioning & Updates
"useful", Positive Feedback
"Hay un error!!! Uncaught (in promise) TypeError: Cannot read property 'length' of undefined Corríjanlo!", Negative Feedback or Complaints
"Waiting for Lighthouse results ... after 5s Error rendering report: Cannot read property 'length' of undefined",Performance & Accuracy
"Good Tool! It can be used for quick results.","Usability & Workflow, Performance & Accuracy"
"Used to work offline as version 5.4.0.0 but now with version 100.0.0.0 it fails while it looks for gitHub.",Versioning & Updates
"Lighthouse is a MUST for any serious dev. I use it in conjunction with the WebHint extension.",Usability & Workflow
"useful", Positive Feedback
"This extension is now built in to Chrome dev tools.",Usability & Workflow
"Very good app... Suddenly crashed though... Log File: **Lighthouse Version**: 5.2.0 **Lighthouse Commit**: ba1e1591dd83fe411f058df31a994df76796f646 **Chrome Version**: 76.0.3809.132 **Initial URL**: https://gabbitas.com/ **Error Message**: Waiting for DevTools protocol response has exceeded the allotted time. (Method: Network.clearBrowserCache) **Stack Trace**: ``` LHError: PROTOCOL_TIMEOUT at chrome-extension://blipmdconlkpinefehnmjammfjpmpbjk/scripts/lighthouse-ext-bundle.js:22728:11 ```,"Usability & Workflow, Versioning & Updates"
"Doesn't work at all on Debian systems. Useless.", Negative Feedback or Complaints
"very helpful browser icon :-)",Positive Feedback
"ok", Positive Feedback	
"helpfull",Positive Feedback
"Works good but can you update to the latest light house version to match web.dev ?",Versioning & Updates
"ok", Positive Feedback
"Very interesting", Positive Feedback
"The overview forgets to mention, you don't need this extension anymore - the feature it built into DevTools in the current version of Chrome. Installing this gives you nothing new. Just use the 'Audits' tab in DevTools.","Feature Requests, Usability & Workflow, Versioning & Updates"
"Simply one of the best performance tools you can use. It only continues to improve.", Performance & Accuracy
"good potential. Currently limited to 1 use case only. More detail should be given for the 3G network simulation as that means many different speeds depending on country.",Feature Requests
"Best ever I found in my 12 years career.", Positive Feedback
"I think this tool has great potential, but unfortunately, at the moment it is only possible to run an audit emulating on mobile Nexus 5X and using a 3G network connection, which doesn't make much sense to me. At its current state, I'll stick to the DevTools version, where it's possible to choose the emulation options.","Usability & Workflow, Versioning & Updates, Positive Feedback"
"It's a good tool, but as it stands it can only generate one report, then the extension needs to be deactivated and reactivated because all buttons in its GUI stops responding after the first usage.",Usability & Workflow
"Why is this emulating a nexus... on a 3G network? Does anyone even use 3G anymore? Lets get a bit more modern and use LTE or WIFI speeds and stop throttling, or at least allow user running the test to set their own environment.", "Negative Feedback or Complaints, Feature Requests"
"Awesome...", Positive Feedback 
"Great App,I hope there will be more features","Feature Requests, Positive Feedback"
"Great extension !!!","Usability & Workflow, Positive Feedback"
"Excellent utility!!!", Positive Feedback
"Doesnt work for Chrome in Mac. The browser is updated to the latest version. It doesn't even give any error or compatibility issues with other plugins that I am using.",Versioning & Updates
"Excellent for testing and debugging issues!", Positive Feedback
"Fantastic tool for developing Progressive Web Apps (PWAs) and optimizing your site for its full potential!",Feature Requests
"Easy to use. Good extension! Thanks!",Usability & Workflow
"Good extension.", Positive Feedback
"Broken. Records page load times as REALLY long incorrectly", Negative Feedback or Complaints
"This has stopped working, was fine a few days ago.", Negative Feedback or Complaints
"it doesn't work at all", Negative Feedback or Complaints
"Latest version broke. :( Good thing there's an alternate way in Chrome to run the report.","Versioning & Updates, Negative Feedback or Complaints"
"perfect!", Positive Feedback
"Awesome tool. Highly recommended.", Positive Feedback
"Good! Extension is very useful",Usability & Workflow
"Good tool for Onsite SEO and web dev.", Positive Feedback
"Very useful so far. Also frightening.", "Positive Feedback, Negative Feedback or Complaints"
"Very useful. Takes a minute to understand the true value of what the numbers represent but then its fantastic,","Positive Feedback, Negative Feedback or Complaints"
"Works great i have got a lot of use.",Positive Feedback
"Really quick, useful tool to help me spot errors across clients sites.",Usability & Workflow
"This has been a great help while optimizing my websites.",Positive Feedback
"Keep it up ! Still need some further improvement.","Feature Requests, Negative Feedback or Complaints"
"It always try to run mobile checks first, so sites redirect to mobile version and this bornbroken thing start to test only mobile site.",Versioning & Updates
"Outstanding!", Positive Feedback
"Great tool to assisting an SEO and web devOps!",Positive Feedback
"Broken. Tried repeatedly, different sites, always sticks on 'Loading page & waiting for onload'.", Negative Feedback or Complaints
"Sometimes works, sometimes doesnt work. Overall good.", "Negative Feedback or Complaints, Positive Feedback"
"essential. every web site developer should test their sites with this and fix any reported issues. The screenshots are out of date - it looks nicer than it shows. :-)","Positive Feedback"
"Report says : Open new tabs using rel='noopener' to improve performance and prevent security vulnerabilities. But, a rel=noreferrer has the same behaviour as noopener. Update must be made.","Performance & Accuracy, Versioning & Updates"
"Great tool, very very helpful",Positive Feedback
"Great tool. The node CLI is great too. I've used with chrome on windows 10 and my 2015 macbook pro.",Positive Feedback
"Very helpful tool!",Positive Feedback
"So useful and so easy to get into.",Usability & Workflow
"Simply superb",Positive Feedback
"It is good for a quick checkup, but it ignores offline functionality implemented with app cache (which is still necessary while Edge and Safari lack service worker support).","Feature Requests, Usability & Workflow"
"Quick perf rule analysis that takes into account making the web 'Reliable' for your users. Confirms you are caching content for offline scenarios with service workers. Love It!","Usability & Workflow, Performance & Accuracy, Positive Feedback"
"It is awesome tool to test service worker functionality in application by developer and other people who wants to verify the service worker implementation.",Feature Requests
"They are playing by the same rules; page speed simply isn't the only (nor the most important) factor in ranking. If you search for 'Amazon Kindle' some little blog with a 100/100 lighthouse score shouldn't come first.", Performance & Accuracy
"You're right. I've been doing SEO for years now for clients and on my own site. I rank #2 for a few local keywords, and I'll never rank #1. Wanna know why? The #1 spot has a PBN. My site is objectively better in terms of on page SEO, UX, lighthouse / page speed scores, and I have a blog that pumps out fresh content (he doesn't have one). But Google doesn't care. It's because he has a PBN setup with thousands of backlinks, is why he holds that spot. No matter what Google says, ranking well has always been about and will always be about backlinks.",Versioning & Updates
"Ultimately, Google and any other search engine is interested in showing the best results for a given query to users. How often a user clicks on a result and whether or not the user returns to search and ends up clicking a different result are basically the most important thing for ranking. But they also know that things like performance and responsiveness and accessibility are, in addition to content, important factors in predicting whether a user will remain on a site or leave (if the page is really slow, you're gonna have a bad experience, and possibly go elsewhere). So performance is just one of many factors. Relevance to the query and how many users made a similar query for which that result was what they were looking for are and should be the most important factors. That basically means the popularity of a site is one of the key factors in ranking.","Performance & Accuracy, Negative Feedback or Complaints"
"To be clear, lighthouse scores is a TIE BREAKER. The search term matching is absolutely more important and it's honestly going to be rare where you have the same score as another website and lighthouse scoring tiebreaker will come into play. Get high LH scores to make your site more pleasant to use, not to get a higher ranking on SERP.",
"Page speed is massively overstated for SEO. It's a very small factor. Of course it's good to have a fast site anyway, for your users, but most people wouldn't notice a difference between 80-100 lighthouse score. Plus lighthouse massively undervalues TTFB (time to first byte).", Feature Requests
"It's just a tie breaker. That's it, you honestly shouldn't expect it to place you more than a single ranking higher. I've never seen it have an effect tbh. That said, absolutely try to get a good ranking (doesn't need to be 100/100) because it makes your site more pleasant to use.", Performance & Accuracy
"It depends on what your site is for. I basically think of the following dichotomy: sites people have to use vs sites people don't have to use. An example of a site people don't have to use is an online retailer. Since people could go elsewhere, performance really matters. It's showing how a minor bit of extra time to load can affect conversion numbers. Here you should be aiming to get that lighthouse score perfect. An example of a site people have to use is a B2B sass app that does some business function like product management software, intranets, etc. Its users HAVE to use it because their company paid for them to use it. While we should strive to build performant sites every time blah blah blah, the truth is it becomes much less important in these kind of sites as you essentially have a captive audience.","Usability & Workflow, Performance & Accuracy, Versioning & Updates"
"Well that to Amazon, last time I checked their lighthouse site performance was 30 something.",Performance & Accuracy
