Review,Categories
"In my opinion, having a decent Lighthouse/page speed/etc. score should be the bare minimum. There are a lot of other factors to consider when thinking of quality and speed (which are not mutually exclusive): perceived speed and providing feedback in the UI when things are happening, length of flows (especially with checkouts), amount of info collected on forms, partial updates vs full page loads (non-SPA), ensuring minimal re-renders (SPA), pagination vs infinite scroll and when to use them. There are no scoring tools for a 'good' website. But using things like Lighthouse and page speed are a good indicator it isn't your code causing the problems.","Usability & Workflow, Versioning & Updates"
"I'm not really concerned with SEO. I try to make websites that are fast, nice to use, accessible, and have a low web carbon. Lighthouse is a useful metric for this.",
"Google wants that the stuff you find on google works. If you used google and only found crappy pages that took seconds to load, you'd think google was crap.",
"Does it matter? Depends. looks like you're thinking about in SERPs. IMHO in 20 years of SEO, the same ideas still hold true. Have backlinks, Create good content , (Use words your customers are searching for in your headings and other content areas), and make the site easy to use where they don't bounce. That's it. The pagespeed score factors in there somewhere, but all those technical metrics only matter when everything else is about equal. It's why older or slow sites still rank well. People keep going there and people keep linking to it, and they keep linking to it because people go there..... and so on. I've had customers obsess of synthetic metrics, meanwhile they want to rank for terms they don't even have service pages for, or are thin on content. SMH.","Usability & Workflow, Versioning & Updates"
"It is a relatively small factor. It does play a role in ranking, however most other factors have to be very similar between sites for it to come into effect.",
"Good question. It should matter but if they don't then perhaps it's another sign that search engines have lost the SEO war. The systems they introduced to return the best results from the internet were quickly overwhelmed by people learning to game the algorithm for profit. Once Google achieved its near total search monopoly, they shifted to serving adverts over good quality results so things like Lighthouse scores don't get a chance to make the difference. That said, I still think the audits are valuable. The metrics are measuring tangible, real-world things and it's the most universal front end analysis tool to you can see how site A compares with site B. I do think a site with a good Lighthouse score (achieved genuinely) usually feels better to use, and while that may not matter as much to search engines, it still matters to users. Also, because they're presented in a style that's digestible by anyone, you can use the results in presentations too.","Usability & Workflow, Performance & Accuracy"
"Lighthouse score doesn't affect search ranking. Core Web Vitals from field data do. It's important to have good CWV and Lighthouse can help you improve those but it's completely possible to have a good Lighthouse score and a bad performing site and vice versa.",Negative Feedback or Complaints
"Content matters the most. But I would bet it can help give you a boost if you and your competitor are both cranking out quality content.", Performance & Accuracy
"I mean, if you 'accidentally' get 90/100, by all means advertise that. But some clients think it's then end all be all. And most of the (IME) the biggest offenders are things you don't control.", Negative Feedback or Complaints
"It definitely impacts your rankings. I work at a relatively larger tech company and we've had multiple drop-everything perf issues because Google notified us that we'd start getting down ranked if we didn't fix perf on specific pages. That said, some sites are so relevant that having bad performance doesn't really impact their ratings. If you search for short term rentals somewhere, Airbnb is getting clicks and converts so often that they're going to stay at the top essentially no matter what. Site performance is a very important metric, but it's not the only metric, so things balance out.","Performance & Accuracy, Negative Feedback or Complaints"
"I'm of the mindset that building performant web apps is so easy that you'd be stupid not too. Honestly I find it harder to get bad scores and the code becomes a pain to read. Just follow best practices for HTML, CSS & JavaScript and then even when building something in React or another framework it'll usually end up good enough. I usually end up with things being built with at least 85 performance, easily tweaked to 100. I've heard some people have issues with analytics trackers etc.","Usability & Workflow, Performance & Accuracy, Negative Feedback or Complaints"
"Not much, until someone ignorant enough makes it your quarterly KPI.", Negative Feedback or Complaints
"It's a very impactful metric. Especially for small business sites in local markets. The reason the bigger sites can get away with low scores is because their domain authority makes up for it. They have tens of thousands of backlinks and social media engagement and reach online that their page speed score doesn't really matter. When you have a high authority site with 20k backlinks and lots of social engagement versus a new site with no backlinks and no social profiles but 100 page speed scores guess who's gonna win? Thats how it works. Small business sites don't have the Authority those big sites have. So they need to play the game a lot differently and that's where page speed matters the most. They don't have domain authority. So they need to make up for it on content quality and page speed scores to gain an edge over their local competition.", Performance & Accuracy
"Lighthouse scores change all the time. There's usually not that much in it but it's never the same each time. I doubt it had anything to do with your browser.", Negative Feedback or Complaints
"Usually it's because browser adons or plugins are affecting the score but are not there in the incognito test. I always test in incog for that reason.", Negative Feedback or Complaints
"Every site I have built and run thought lighthouse scored very well, but had first contentful paint times in the 5 to 10 second range, even though the timeline clearly shows everything loaded in less than 1 second. I still can't figure that out.", "Usability & Workflow, Negative Feedback or Complaints"
