Review,Categories
"insane",Positive Feedback
"Great extension! Makes the search experience much easier and informed",Usability & Workflow
"Can I pay for this app? I found it super simple but amazingly beneficial",Positive Feedback
"The extension works great! Helps a lot to identify the sponsored items! A must have!",Positive Feedback
"It's good to stop the dark patterns of Skroutz!",Positive Feedback
"works well and reliefs the eye sore and annoyance of checking what is sponsored or not",Performance & Accuracy
"awesome job. very useful chrome extension by my friend io !!! big thumbs up",Positive Feedback
"skroutz wants to take our money this saved me",Positive Feedback
"Excellent job, works perfectly, thank you for creating and maintaining this!",Positive Feedback
"Gods live among us.",Positive Feedback
"Good idea and great implementation",Positive Feedback
"Great extension. Does exactly what it is supposed to.",Performance & Accuracy
"A nice extension that makes really easy to spot the sponsored items in a Skroutz webpage.",Usability & Workflow
"Makes my search easier 🙌 🙌 🙌 This extension has genuinely made shopping so much less stressful and straightforward.",Usability & Workflow
"Just wanted to report that on Firefox Android, it seems to somehow break the scaling of the website. I can zoom out past the website edges and some content is very difficult to read due to scaling issues (filter list etc.)",Negative Feedback or Complaints
"Thank you for your work!",Positive Feedback
"I love Samsung, as does reSkroutzed!",Positive Feedback
"Very good idea. Well done. I would like there to be an option to completely disappear sponsored products whenever you want with an On/Off button.",Feature Requests
"I can't believe there's an extension for something as personalized as Skroutz <3",Positive Feedback
"This extension is a game-changer! It makes finding the best deals so much easier.",Positive Feedback
"Finally, an extension that helps me avoid all the sponsored ads. Love it!",Positive Feedback
"Super helpful tool! It saves me so much time when shopping online.",Usability & Workflow
"Great job on this extension! It works flawlessly and is very user-friendly.",Positive Feedback
"I can't imagine shopping without this extension now. It's a must-have!",Positive Feedback
"This extension has made my online shopping experience so much better. Highly recommend!",Positive Feedback
"Fantastic extension! It helps me quickly identify the best deals.",Performance & Accuracy
"Love this extension! It makes it so easy to spot sponsored items.",Positive Feedback
"This extension is a lifesaver! It helps me avoid all the annoying ads.",Positive Feedback
"Great idea and execution. This extension is very useful.",Positive Feedback
"Very helpful extension. It does exactly what it promises.",Performance & Accuracy
"This extension has made my shopping experience much more enjoyable.",Positive Feedback
"Excellent tool! It helps me find the best deals quickly.",Positive Feedback
"Great extension! It makes online shopping so much easier.",Usability & Workflow
"This extension is a must-have for anyone who shops online.",Positive Feedback
"Love this extension! It saves me so much time and effort.",Positive Feedback
"Fantastic job on this extension! It's very useful and easy to use.",Positive Feedback
"This extension is a game-changer for online shopping.",Positive Feedback
"Great extension! It helps me avoid all the sponsored ads.",Positive Feedback
"This extension is very helpful and works perfectly.",Performance & Accuracy
"Love this extension! It makes finding the best deals so much easier.",Positive Feedback
"This extension is a must-have for anyone who shops online.",Positive Feedback
"Great job on this extension! It's very useful and easy to use.",Positive Feedback
"This extension has made my online shopping experience so much better.",Positive Feedback
"Fantastic extension! It helps me quickly identify the best deals.",Performance & Accuracy
"The extension is good, but it crashes frequently on my browser. Needs improvement.",Negative Feedback or Complaints
"I wish the extension had more customization options. It's too basic right now.",Feature Requests
"Sometimes the extension doesn't load properly and I have to refresh the page.",Negative Feedback or Complaints
"The extension slows down my browser significantly. Needs optimization.",Negative Feedback or Complaints
"It would be great if the extension could filter out more types of ads.",Feature Requests
"The interface is not very user-friendly. It needs a redesign.",Negative Feedback or Complaints
"I often get errors when using the extension. Please fix the bugs.",Negative Feedback or Complaints
"The extension doesn't always detect sponsored items correctly.",Negative Feedback or Complaints
"I would like to see more detailed analytics on my shopping habits.",Feature Requests
"The extension is missing some key features that other similar tools have.",Feature Requests
"The customer support for this extension is very slow to respond.",Negative Feedback or Complaints
"I wish the extension had a dark mode option.",Feature Requests
"The extension sometimes blocks legitimate content. Needs better filtering.",Negative Feedback or Complaints
"It would be helpful if the extension could integrate with other shopping tools.",Feature Requests
"The extension is too resource-intensive. It drains my battery quickly.",Negative Feedback or Complaints
"I would like to see more frequent updates and improvements.",Feature Requests
"The extension doesn't work well on mobile devices.",Negative Feedback or Complaints
"It would be great if the extension could provide price comparison features.",Feature Requests
"The extension often freezes my browser. Needs better performance.",Negative Feedback or Complaints
"I wish the extension had a more intuitive setup process.",Feature Requests
"The extension needs to be updated more frequently to keep up with changes on the website.",Versioning & Updates
"I find the versioning of this extension to be confusing. It's hard to tell which version I'm using.",Versioning & Updates
"The extension often prompts for updates, but the process is not intuitive.",Versioning & Updates
"Version updates are not seamless and often require a browser restart.",Versioning & Updates
"The current version has some bugs that need to be fixed. Please update soon.",Versioning & Updates
"I wish the extension had an auto-update feature to avoid manual updates.",Versioning & Updates
"The version history is not clear. It would be helpful to see what changes were made in each update.",Versioning & Updates
"The extension's versioning system is not user-friendly. Needs improvement.",Versioning & Updates
"The latest version introduced some issues that were not present before. Needs a rollback option.",Versioning & Updates
"The extension needs better version control. It's hard to keep track of updates.",Versioning & Updates